{"adopted_at":"2026-08-05T00:00:00Z","authorization":{"single_use":true,"ttl_seconds":600},"default_outcome":"HOLD","description":"Insurance claims workflow gate: auto-approval only under declared authority, fresh documentation, and coverage; everything unsettled escalates instead of guessing.\n","evidence":[{"id":"coverage","max_age_seconds":3600,"ref":"https://api.internal.example/coverage","source":"http"},{"id":"docs_complete","max_age_seconds":86400,"ref":"./claim/docs-manifest.json","source":"file"},{"id":"authority_limit","max_age_seconds":604800,"ref":"./claim/authority.json","source":"file"}],"rulebook_id":"claims-gate","rules":[{"id":"over-authority","outcome":"HOLD","reason":"Amount exceeds this adjuster's declared authority; route to named escalation.","when":"candidate.action.params.amount > evidence.authority_limit"},{"id":"coverage-denies","outcome":"BLOCK","reason":"Coverage determination excludes this claim category. This is a denial, not an unknown.","when":"fresh(coverage) and evidence.coverage == \"excluded\""},{"id":"auto-approve-in-authority","outcome":"ALLOW","reason":"Covered, documented, within declared authority.","when":"fresh(coverage) and evidence.coverage == \"covered\" and present(docs_complete) and candidate.action.params.amount <= evidence.authority_limit"}],"track":["claim_id","adjuster_id"],"version":"1.0.0"}